{
  "kind": "tweak",
  "title": {
    "en": "Test row ok",
    "tr": "Test satırı ok"
  },
  "why": {
    "en": "Fixture for the apply and verify tests.",
    "tr": "Uygulama ve doğrulama testleri için örnek."
  },
  "fixed": {
    "en": "The test level is now right.",
    "tr": "Test düzeyi artık doğru."
  },
  "risk": "safe",
  "sources": [
    "https://learn.microsoft.com/powershell/"
  ],
  "gain": [
    "experience"
  ],
  "detect": "(Get-ItemProperty -LiteralPath $env:FPSTUNE_TEST_KEY -Name Level -ErrorAction Stop).Level",
  "target": {
    "value": 1
  },
  "apply": "Set-ItemProperty -LiteralPath $env:FPSTUNE_TEST_KEY -Name Level -Value $Target",
  "revert": "Remove-ItemProperty -LiteralPath $env:FPSTUNE_TEST_KEY -Name Level",
  "restart": "none"
}
