{
  "kind": "tweak",
  "title": {
    "en": "Test row detect_many",
    "tr": "Test satırı detect_many"
  },
  "why": {
    "en": "Fixture for the detect classification tests.",
    "tr": "Algılama sınıflandırma testleri için örnek."
  },
  "fixed": {
    "en": "The test value is now right.",
    "tr": "Test değeri artık doğru."
  },
  "risk": "safe",
  "sources": [
    "https://learn.microsoft.com/powershell/"
  ],
  "gain": [
    "experience"
  ],
  "detect": "1, 2",
  "target": {
    "value": 1
  },
  "apply": "Set-ItemProperty -LiteralPath $env:FPSTUNE_TEST_KEY -Name Level -Value $Target",
  "revert": "Remove-ItemProperty -LiteralPath $env:FPSTUNE_TEST_KEY -Name Level"
}
